{"type":"config","name":"cli-33-skill-query-triggers","metric_name":"f1","metric_unit":"f1","direction":"higher","maxIterations":null,"segment":1,"timestamp":1778057180,"note":"restart with project-scoped skill harness (bash+jq, no python, no global skill mutation)"}
{"type":"result","metric":0.9778,"metrics":{"f1":0.9778,"precision":0.9565,"recall":1.0,"accuracy":0.9762,"fp":1,"fn":0},"status":"keep","description":"baseline (simple, ~245 chars per Anthropic best-practices): 'Runs Cypher and manages Neo4j Aura from the terminal via the neo4j-cli CLI. Use when the user wants to execute Cypher, introspect a Neo4j schema, manage Aura instances/tenants/credentials, or install/remove the neo4j-cli skill in an agent.'","commit":"pending","segment":1,"timestamp":1778057500}
{"type":"result","metric":0.9767,"metrics":{"f1":0.9767,"precision":1.0,"recall":0.9545,"accuracy":0.9762,"fp":0,"fn":1},"status":"keep","description":"iter1: append SKIP clause for cypher-syntax / drivers / Docker-Kubernetes / Browser / other-DBs. Bumped runs-per-query to 3 for stable signal. Kubectl FP fixed.","commit":"pending","segment":1,"timestamp":1778058200}
{"type":"result","metric":0.9302,"metrics":{"f1":0.9302,"precision":0.9524,"recall":0.9091,"accuracy":0.9286,"fp":1,"fn":2},"status":"discard","description":"iter2 (DISCARD): added 'uninstall' verb + verbatim 'remove the neo4j-cli skill from my agent' example. Made kubectl FP consistent (3/3) and added a new schema-uri FN. Reverting.","commit":"-","segment":1,"timestamp":1778058600}
{"type":"result","metric":0.9767,"metrics":{"f1":0.9767,"precision":1.0,"recall":0.9545,"accuracy":0.9762,"fp":0,"fn":1},"status":"discard","description":"iter3 (DISCARD): rephrase skill-management as 'use `neo4j-cli skill` to install/remove the bundled agent skill'. Tied f1, no FN improvement.","commit":"-","segment":1,"timestamp":1778059000}
{"type":"result","metric":0.4286,"metrics":{"f1":0.4286,"precision":1.0,"recall":0.2727,"accuracy":0.6429,"fp":0,"fn":16},"status":"discard","description":"iter4 (DISCARD): drop SKIP clause to test if it's load-bearing. MASSIVE regression — recall collapsed 0.95→0.27. SKIP signals 'this skill is well-scoped' and helps recall too, not just precision.","commit":"-","segment":1,"timestamp":1778059600,"note":"approximate metrics from visible failure list; ~16 FNs"}
{"type":"result","metric":0.5,"metrics":{"f1":"varies","precision":"~0.95","recall":"unstable","accuracy":"varies","fp":0,"fn":"1-10"},"status":"discard","description":"iter5 (DISCARD): 'including its own agent-skill bundle install/remove' preamble. UNSTABLE — first run f1=0.9767 with skill-remove fixed but aura-delete FN'd; second run produced 10 FNs across cypher/aura/credential/skill. Variance too high to ship.","commit":"-","segment":1,"timestamp":1778060000}
{"type":"result","metric":0.7429,"metrics":{"f1":0.7429,"precision":1.0,"recall":0.5909,"accuracy":0.7857,"fp":0,"fn":9},"status":"comparison","description":"iter1 description re-run on claude-haiku-4-5 (instead of claude-sonnet-4-6). Same description, F1 drops 0.98 → 0.74. Precision holds at 1.0; recall collapses 0.95 → 0.59. Haiku is much more conservative about reaching for skills.","commit":"-","segment":1,"timestamp":1778060500,"model":"claude-haiku-4-5"}
